{
  "ambiguities": [
    {
      "evidence": "The source differentiates p and u and uses 1/rho and c = sqrt(K/rho); it states c > 0 in the one-way-wave discussion but does not display a full quantified admissibility block for K and rho.",
      "impact": "A formal version may expose necessary smoothness and positivity/nonzero assumptions, but should preserve the same physical parameter regime and not detach the mode identity from it.",
      "issue": "Regularity and parameter inequalities are implicit."
    }
  ],
  "batch_source_contract_sha256": "d8fdc23104f3a4ce44add59aa66515c36255136ffeac295b5f757fb7be5f1438",
  "contract_plain_english": "Every sufficiently regular solution of the one-dimensional acoustics system has a right characteristic combination w^1 = p + rho*c*u satisfying w^1_t + c*w^1_x = 0, so it propagates right with sound speed +c.",
  "role": "source-contract",
  "schema_version": "formalization-faithfulness-1",
  "source_evidence": [
    {
      "anchor": "Equation (1.4) and the preceding sentence about a sound wave propagating to the right",
      "location": "raw PDF page 24; printed Chapter 1 page 2",
      "observation": "For c > 0 the source identifies v_t + c v_x = 0 as a one-way wave equation modeling a sound wave propagating to the right with speed c."
    },
    {
      "anchor": "Paragraph beginning 'To connect this with the one-way wave equation (1.4)'",
      "location": "raw PDF page 24; printed Chapter 1 page 2",
      "observation": "Under the acoustics system (1.5), the source sets w^1(x,t) = p(x,t) + rho*c*u(x,t), defines c = sqrt(K/rho), and states w^1_t + c*w^1_x = 0, thereby identifying c as the speed of sound."
    }
  ],
  "source_sha256": "b3adec0d3616dbde57a5522cfce1861890887d7c03a2232d2136cb94c9bac1d5",
  "statement": {
    "binders": [
      "Sufficiently differentiable real-valued functions p(x,t) and u(x,t).",
      "Real material constants K and rho, the sound speed c, and the scalar characteristic variable w^1(x,t)."
    ],
    "conclusions": [
      "w^1_t + c*w^1_x = 0.",
      "This is the right-going one-way wave equation with propagation speed +c, the speed of sound."
    ],
    "definitions_and_conventions": [
      "Subscripts t and x denote partial derivatives.",
      "The plus sign in w^1 = p + rho*c*u selects the right-going characteristic combination.",
      "For c > 0, the scalar transport equation v_t + c v_x = 0 models propagation to the right."
    ],
    "hypotheses": [
      "p_t + K u_x = 0 and u_t + (1/rho) p_x = 0.",
      "c = sqrt(K/rho) in the physical regime where c > 0 and rho is nonzero.",
      "w^1 = p + rho*c*u."
    ],
    "implicit_context": [
      "The system is the one-dimensional constant-coefficient acoustic system (1.5).",
      "The differentiability needed to form the displayed derivatives is assumed rather than quantified."
    ],
    "semantic_facets": [
      {
        "details": [
          "The right mode is the specific linear combination p + rho*c*u."
        ],
        "topic": "characteristic variable"
      },
      {
        "details": [
          "The PDE sign is positive and the transport speed is +c, which the source associates with rightward travel."
        ],
        "topic": "propagation direction"
      }
    ]
  },
  "task_id": "LEV-CH01-ACOUSTICS-RIGHT-MODE",
  "undebatable_constraints": [
    "The mode combination must use p + rho*c*u, not p - rho*c*u.",
    "The scalar PDE must be w^1_t + c*w^1_x = 0.",
    "The propagation speed is +c and the physical direction is right for c > 0.",
    "The sound speed must satisfy c = sqrt(K/rho).",
    "The mode equation is derived under the coupled acoustics system (1.5), not asserted for arbitrary unrelated p and u."
  ]
}
