{
  "schema_version": "formalization-faithfulness-1",
  "role": "source-contract",
  "task_id": "HDP-01-EQ-1.6",
  "source_sha256": "855fdaf6870f664f1e470d47641b6d72758afdb9b87649a6494b027cecc02b17",
  "source_evidence": [
    {
      "location": "PDF page 5; printed page 9; Section 1.3; prose immediately preceding Equation (1.6)",
      "anchor": "“Recall that the standard normal distribution, denoted N(0,1), has density”",
      "observation": "The source identifies N(0,1) as the standard normal distribution and explicitly characterizes the displayed function as its density."
    },
    {
      "location": "PDF page 5; printed page 9; Section 1.3; Equation (1.6)",
      "anchor": "f(x) = (1/√(2π)) e^(−x²/2), x ∈ R",
      "observation": "The density is specified pointwise on the entire real line, with normalization factor 1/√(2π) and exponent −x²/2."
    },
    {
      "location": "PDF page 5; printed page 9; Section 1.3; paragraph and display immediately following Equation (1.6)",
      "anchor": "“normalize it to obtain a random variable with zero mean and unit variance” followed by “Z_N → N(0,1) in distribution”",
      "observation": "The surrounding source context uses N(0,1) as the zero-mean, unit-variance normal distribution; the second parameter is variance."
    }
  ],
  "statement": {
    "binders": [
      "x ∈ ℝ, universally ranging over all real numbers"
    ],
    "hypotheses": [],
    "conclusions": [
      "For every x ∈ ℝ, the standard normal distribution N(0,1) has density f(x) = (1/√(2π)) exp(−x²/2)."
    ],
    "definitions_and_conventions": [
      "N(0,1) denotes the standard normal distribution.",
      "The parameters of N(0,1) are mean 0 and variance 1.",
      "The symbol f names the density of this distribution.",
      "The display uses exp(−x²/2), written in the source as e^(−x²/2).",
      "The normalization denominator is √(2π), with both 2 and π under the square root."
    ],
    "implicit_context": [
      "Equation (1.6) is a recalled identification of the standard normal density immediately before the central limit theorem, not a conclusion requiring the theorem’s hypotheses.",
      "The qualifier x ∈ ℝ gives the formula universal pointwise scope over the full real line.",
      "The display concerns a probability density, not a cumulative distribution function, tail probability, or point mass.",
      "No assumptions about an i.i.d. sequence, sample size, or limiting process belong to Equation (1.6) itself."
    ],
    "semantic_facets": [
      {
        "topic": "Distribution",
        "details": [
          "The subject is the standard normal, also called standard Gaussian in the surrounding prose.",
          "Its notation is N(0,1)."
        ]
      },
      {
        "topic": "Parameterization",
        "details": [
          "The mean parameter is 0.",
          "The variance parameter is 1."
        ]
      },
      {
        "topic": "Density semantics",
        "details": [
          "The source explicitly says that N(0,1) has density f.",
          "The display gives and identifies that density function rather than merely introducing an unrelated real-valued function."
        ]
      },
      {
        "topic": "Domain and quantification",
        "details": [
          "The variable x ranges over every real number.",
          "There are no exceptional points or restricted subdomains."
        ]
      },
      {
        "topic": "Formula normalization",
        "details": [
          "The multiplicative constant is exactly 1/√(2π).",
          "The exponential term is exactly exp(−x²/2)."
        ]
      }
    ]
  },
  "undebatable_constraints": [
    "The distribution is the standard normal distribution denoted N(0,1).",
    "N(0,1) is parameterized by mean 0 and variance 1.",
    "The displayed function f is identified as a density.",
    "The formula applies to all x ∈ ℝ.",
    "The normalization factor is exactly 1/√(2π).",
    "The exponent is exactly −x²/2.",
    "The claim is pointwise equality of the density with the displayed formula, not a CDF or tail formula."
  ],
  "ambiguities": [
    {
      "issue": "The prose grammatically recalls that the distribution “has density” rather than issuing a standalone command to define f.",
      "evidence": "The sentence preceding Equation (1.6) says “Recall that the standard normal distribution, denoted N(0,1), has density,” and the display then introduces f(x) by equality.",
      "impact": "The display unambiguously gives and identifies the density of N(0,1), although its presentation is a recalled characterization rather than a formally labeled definition."
    }
  ],
  "contract_plain_english": "Equation (1.6) identifies the density of the standard normal distribution N(0,1), whose parameters are mean 0 and variance 1. For every real x, that density is f(x) = exp(−x²/2)/√(2π). The display is specifically a density formula, not a CDF, tail probability, or point-mass statement."
}
