{
  "ambiguities": [],
  "batch_source_contract_sha256": "856d0400f37d309d6e394f4e5d704d0cd26bb8d59f2cdc4932f9f89bb4eb46e9",
  "contract_plain_english": "For any two real numbers a and b, their product is at most one half of a squared plus one half of b squared.",
  "role": "source-contract",
  "schema_version": "formalization-faithfulness-1",
  "source_evidence": [
    {
      "anchor": "Proof of Lemma 2.7.7, sentence introducing the elementary Young inequality",
      "location": "PDF page 23; printed page 34",
      "observation": "The source states ab <= a^2/2 + b^2/2 for a,b in R."
    },
    {
      "anchor": "First inequality in the proof of Lemma 2.7.7 after display (2.22)",
      "location": "PDF page 23; printed page 34",
      "observation": "The inequality is applied pointwise to bound |XY| by X^2/2 + Y^2/2 inside the exponential."
    }
  ],
  "source_sha256": "ecc53be86c091b5df118c4464b6d81672e0261df960a3f32ceea4900107d090a",
  "statement": {
    "binders": [
      "a, b in R"
    ],
    "conclusions": [
      "a*b <= a^2/2 + b^2/2."
    ],
    "definitions_and_conventions": [
      "The square and order are the ordinary real square and order.",
      "The constants 1/2 are exact."
    ],
    "hypotheses": [],
    "implicit_context": [
      "This is a deterministic real inequality; it does not require probabilistic assumptions."
    ],
    "semantic_facets": [
      {
        "details": [
          "Both variables range over all real numbers."
        ],
        "topic": "domain"
      },
      {
        "details": [
          "The product is bounded above by the arithmetic mean of the two squares."
        ],
        "topic": "algebraic bound"
      }
    ]
  },
  "task_id": "HDP-02-BODY-2.7-YOUNG",
  "undebatable_constraints": [
    "The domain is all a,b in R.",
    "The left-hand side is ab, with no absolute value in the displayed Young inequality itself.",
    "The right-hand side is exactly a^2/2 + b^2/2.",
    "There are no additional hypotheses."
  ]
}
