{
  "ambiguities": [
    {
      "evidence": "Immediately after defining w^2 and displaying its PDE, the printed text says 'solutions of the form q^2(x,t) = q-tilde(x+ct)'.",
      "impact": "The direction and x + ct dependence are clear, but a formal statement should disclose whether it normalizes the apparent symbol mismatch to w^2 or preserves it as a generic scalar solution notation.",
      "issue": "The traveling-profile sentence changes the mode symbol from w^2 to q^2."
    },
    {
      "evidence": "The source differentiates p and u and uses 1/rho and c = sqrt(K/rho) without a displayed smoothness class or explicit K > 0, rho > 0 hypotheses in this paragraph.",
      "impact": "A formal version may state the analytically necessary regularity and physical admissibility assumptions, but those are inherited conditions rather than separately advertised conclusions.",
      "issue": "Regularity and parameter inequalities are implicit."
    },
    {
      "evidence": "The wording is 'has solutions of the form', not 'every solution is of the form'.",
      "impact": "The contract supports the displayed solution family and propagation interpretation, not an unqualified converse characterization without additional assumptions.",
      "issue": "The source gives a family of traveling-profile solutions but does not explicitly claim a complete classification of all solutions."
    }
  ],
  "batch_source_contract_sha256": "d8fdc23104f3a4ce44add59aa66515c36255136ffeac295b5f757fb7be5f1438",
  "contract_plain_english": "Every sufficiently regular solution of the one-dimensional acoustics system has a left characteristic combination w^2 = p - rho*c*u satisfying w^2_t - c*w^2_x = 0; its x + ct profiles propagate left with speed -c.",
  "role": "source-contract",
  "schema_version": "formalization-faithfulness-1",
  "source_evidence": [
    {
      "anchor": "Equations (1.5) and the definitions of p, u, K, and rho",
      "location": "raw PDF page 24; printed Chapter 1 page 2",
      "observation": "The full one-dimensional acoustics system is p_t + K u_x = 0 and u_t + (1/rho) p_x = 0, with p the pressure perturbation, u the particle velocity, K the bulk modulus, and rho the density."
    },
    {
      "anchor": "Paragraph beginning 'On the other hand, the function'",
      "location": "raw PDF page 24; printed Chapter 1 page 2",
      "observation": "The source defines w^2(x,t) = p(x,t) - rho*c*u(x,t), states w^2_t - c*w^2_x = 0, assigns propagation speed -c, and prints solutions of the form q^2(x,t) = q-tilde(x+ct) that model motion to the left at the speed of sound."
    }
  ],
  "source_sha256": "b3adec0d3616dbde57a5522cfce1861890887d7c03a2232d2136cb94c9bac1d5",
  "statement": {
    "binders": [
      "Sufficiently differentiable real-valued functions p(x,t) and u(x,t).",
      "Real material constants K and rho, the sound speed c, and the scalar characteristic variable w^2(x,t)."
    ],
    "conclusions": [
      "w^2_t - c*w^2_x = 0.",
      "This scalar equation has propagation speed -c and models an acoustic wave moving to the left at the speed of sound.",
      "Profiles with argument x + ct, printed as q^2(x,t) = q-tilde(x+ct), are solutions of this one-way equation."
    ],
    "definitions_and_conventions": [
      "Subscripts t and x denote partial derivatives.",
      "The minus sign in w^2 = p - rho*c*u selects the left-going characteristic combination.",
      "For c > 0, the scalar transport equation v_t - c v_x = 0 has propagation speed -c."
    ],
    "hypotheses": [
      "p_t + K u_x = 0 and u_t + (1/rho) p_x = 0.",
      "c = sqrt(K/rho) in the physical regime where c > 0 and rho is nonzero.",
      "w^2 = p - rho*c*u."
    ],
    "implicit_context": [
      "The system is the one-dimensional constant-coefficient acoustic system (1.5).",
      "The differentiability needed to form the displayed derivatives is assumed rather than quantified."
    ],
    "semantic_facets": [
      {
        "details": [
          "The left mode is the specific linear combination p - rho*c*u."
        ],
        "topic": "characteristic variable"
      },
      {
        "details": [
          "The PDE sign is negative, the transport speed is -c, and traveling profiles use x + ct."
        ],
        "topic": "propagation direction"
      }
    ]
  },
  "task_id": "LEV-CH01-ACOUSTICS-LEFT-MODE",
  "undebatable_constraints": [
    "The mode combination must use p - rho*c*u, not p + rho*c*u.",
    "The scalar PDE must be w^2_t - c*w^2_x = 0.",
    "The propagation speed is -c and the physical direction is left for c > 0.",
    "The traveling-profile argument is x + ct, consistent with leftward propagation.",
    "The mode equation is derived under the coupled acoustics system (1.5), not asserted for arbitrary unrelated p and u."
  ]
}
