{
  "ambiguities": [
    {
      "evidence": "The sentence immediately before Theorem 2.6.3 literally names Theorem 2.6.3, while Theorem 2.6.2 is the immediately preceding unweighted inequality (PDF p.18/printed p.29).",
      "impact": "This is evidently a cross-reference typo; the intended derivation invokes Theorem 2.6.2. It does not alter Theorem 2.6.3's displayed contract.",
      "issue": "The introductory paragraph says to apply Theorem 2.6.3 to a_iX_i, thereby self-referencing the theorem not yet stated."
    },
    {
      "evidence": "The display contains c, while the preceding sub-gaussian convention identifies C,c>0 as absolute constants (PDF p.16/printed p.27 and PDF p.18/printed p.29).",
      "impact": "Formalization should capture existence of a universal positive constant, not an arbitrary or data-dependent c; no sharp value is required.",
      "issue": "The theorem uses c without local quantification or a numerical value."
    },
    {
      "evidence": "Theorem 2.6.3 permits every a\u2208R^N and imposes no nondegeneracy hypothesis (PDF p.18/printed p.29).",
      "impact": "The source leaves literal division by zero unstated; a formal version must treat degenerate cases or adopt an equivalent convention without silently restricting a or the variables.",
      "issue": "K\u00b2||a||_2\u00b2 can vanish when a=0 or all X_i have \u03c82 norm zero."
    },
    {
      "evidence": "The statement uses X_1,...,X_N, R^N, and max_i without separately declaring N (PDF p.18/printed p.29).",
      "impact": "The conventional source reading is N\u22651; the empty-family case is not specified.",
      "issue": "N is not explicitly quantified or declared positive."
    }
  ],
  "batch_source_contract_sha256": "71dc8e11d8659af56b9929b4ca727149e8f765041778f9ef6eed499fe22326ef",
  "contract_plain_english": "Every deterministic real linear combination of independent centered sub-gaussian variables has a two-sided sub-gaussian tail controlled by the largest individual \u03c82 norm times the Euclidean norm of the coefficient vector (Theorem 2.6.3, PDF p.18/printed p.29).",
  "role": "source-contract",
  "schema_version": "formalization-faithfulness-1",
  "source_evidence": [
    {
      "anchor": "Theorem 2.6.3 and its displayed weighted two-sided tail bound",
      "location": "PDF page 18; printed page 29",
      "observation": "For independent, mean-zero, sub-gaussian X_1,...,X_N, a=(a_1,...,a_N)\u2208R^N, every t\u22650, and K=max_i ||X_i||_{\u03c82}, the theorem bounds P{|\u03a3_i a_iX_i|\u2265t} by 2 exp(-c t\u00b2/(K\u00b2||a||_2\u00b2))."
    },
    {
      "anchor": "Paragraph immediately preceding Theorem 2.6.3",
      "location": "PDF page 18; printed page 29",
      "observation": "The weighted result is introduced by replacing X_i with a_iX_i in the preceding general Hoeffding estimate, although the printed paragraph self-references Theorem 2.6.3 rather than the preceding Theorem 2.6.2."
    },
    {
      "anchor": "Definition 2.5.6, Exercise 2.5.7, and equations (2.13)--(2.16)",
      "location": "PDF page 16; printed page 27",
      "observation": "The \u03c82 quantity is defined by inf{s>0:E exp(X\u00b2/s\u00b2)\u22642}, is called a norm, and the surrounding bounds use positive absolute constants C,c."
    },
    {
      "anchor": "Proposition 2.5.2, especially the mean-zero MGF property (v)",
      "location": "PDF pages 13--15; printed pages 24--26",
      "observation": "The defining sub-gaussian properties are equivalent up to absolute factors, and mean zero supplies the all-\u03bb linear-MGF bound used in the Hoeffding argument."
    }
  ],
  "source_sha256": "ecc53be86c091b5df118c4464b6d81672e0261df960a3f32ceea4900107d090a",
  "statement": {
    "binders": [
      "An implicitly positive integer N and real-valued random variables X_1,...,X_N on a common probability space (Theorem 2.6.3, PDF p.18/printed p.29).",
      "A deterministic coefficient vector a=(a_1,...,a_N)\u2208R^N (Theorem 2.6.3, PDF p.18/printed p.29).",
      "A real threshold t with t\u22650 (Theorem 2.6.3, PDF p.18/printed p.29)."
    ],
    "conclusions": [
      "With K=max_{1\u2264i\u2264N} ||X_i||_{\u03c82}, P{|\u03a3_{i=1}^N a_iX_i|\u2265t}\u22642 exp(-c t\u00b2/(K\u00b2||a||_2\u00b2)) for every t\u22650, where c>0 is absolute (Theorem 2.6.3, PDF p.18/printed p.29; absolute-constant convention after (2.16), PDF p.16/printed p.27)."
    ],
    "definitions_and_conventions": [
      "K=max_{1\u2264i\u2264N} ||X_i||_{\u03c82} (Theorem 2.6.3, PDF p.18/printed p.29).",
      "||a||_2\u00b2=\u03a3_{i=1}^N a_i\u00b2 under the standard Euclidean-norm notation used for a\u2208R^N (Theorem 2.6.3, PDF p.18/printed p.29).",
      "||X||_{\u03c82}=inf{s>0:E exp(X\u00b2/s\u00b2)\u22642} (Definition 2.5.6, equation (2.13), PDF p.16/printed p.27).",
      "The symbols C and c denote positive absolute constants (text following (2.16), PDF p.16/printed p.27)."
    ],
    "hypotheses": [
      "X_1,...,X_N are mutually independent (Theorem 2.6.3, PDF p.18/printed p.29).",
      "Each X_i has mean zero, E[X_i]=0 (Theorem 2.6.3, PDF p.18/printed p.29).",
      "Each X_i is sub-gaussian in the sense of Definition 2.5.6 (PDF p.16/printed p.27)."
    ],
    "implicit_context": [
      "N\u22651 is implicit in X_1,...,X_N and max_i notation (Theorem 2.6.3, PDF p.18/printed p.29).",
      "The coefficients are deterministic reals, while probability and expectation refer to the common ambient probability space of the X_i (Theorem 2.6.3, PDF p.18/printed p.29)."
    ],
    "semantic_facets": [
      {
        "details": [
          "The absolute value makes the displayed estimate two-sided (Theorem 2.6.3 display, PDF p.18/printed p.29)."
        ],
        "topic": "Tail sidedness"
      },
      {
        "details": [
          "The denominator is K\u00b2||a||_2\u00b2, where K is the maximum individual \u03c82 norm (Theorem 2.6.3 display, PDF p.18/printed p.29).",
          "The preceding derivation applies the unweighted theorem to a_iX_i; norm homogeneity gives ||a_iX_i||_{\u03c82}=|a_i| ||X_i||_{\u03c82}, and summing squares is bounded by K\u00b2||a||_2\u00b2 (preceding paragraph and \u03c82-norm convention, PDF pp.16,18/printed pp.27,29)."
        ],
        "topic": "Weighted scale"
      },
      {
        "details": [
          "The same absolute c is independent of N, a, the distributions, and t (absolute-constant convention after (2.16), PDF p.16/printed p.27)."
        ],
        "topic": "Uniformity"
      }
    ]
  },
  "task_id": "HDP-02-THM-2.6.3",
  "undebatable_constraints": [
    "The coefficient vector ranges over all of R^N; no sign, normalization, or nonzero condition is imposed on a (Theorem 2.6.3, PDF p.18/printed p.29).",
    "Independence, zero means, and sub-gaussianity of all X_i are required (Theorem 2.6.3, PDF p.18/printed p.29).",
    "The result holds for every t\u22650 and uses the two-sided event |\u03a3_i a_iX_i|\u2265t (Theorem 2.6.3, PDF p.18/printed p.29).",
    "The denominator is K\u00b2||a||_2\u00b2 with K=max_i ||X_i||_{\u03c82}; replacing K by another scale changes the stated contract (Theorem 2.6.3, PDF p.18/printed p.29).",
    "The bound retains the prefactor 2 and an unspecified positive absolute constant c (Theorem 2.6.3, PDF p.18/printed p.29)."
  ]
}
