{
  "schema_version": "formalization-faithfulness-1",
  "role": "source-contract",
  "task_id": "HDP-02-THM-2.2.5",
  "source_sha256": "ecc53be86c091b5df118c4464b6d81672e0261df960a3f32ceea4900107d090a",
  "source_evidence": [
    {
      "location": "PDF page 6; printed page 17",
      "anchor": "Theorem 2.2.5, title and opening sentence",
      "observation": "The selected result is explicitly titled `Hoeffding's inequality, two-sided` and introduces independent symmetric Bernoulli random variables X_1, ..., X_N, a real coefficient vector a = (a_1, ..., a_N) in R^N, and a threshold t > 0."
    },
    {
      "location": "PDF page 6; printed page 17",
      "anchor": "Theorem 2.2.5, displayed inequality",
      "observation": "The conclusion is P{|sum_{i=1}^N a_i X_i| >= t} <= 2 exp(-t^2/(2 ||a||_2^2)); the absolute value makes the tail two-sided, the threshold comparison is inclusive, and the coefficient scale is the squared Euclidean 2-norm."
    },
    {
      "location": "PDF page 4; printed page 15",
      "anchor": "Definition 2.2.1 (Symmetric Bernoulli distribution)",
      "observation": "A symmetric Bernoulli (Rademacher) random variable takes only the values -1 and 1, each with probability 1/2."
    },
    {
      "location": "PDF page 6; printed page 17",
      "anchor": "Paragraph immediately preceding Theorem 2.2.5, from `We can easily derive` through `Thus the bound doubles`",
      "observation": "Writing S = sum_{i=1}^N a_i X_i, the source identifies {|S| >= t} as the disjoint union of {S >= t} and {-S >= t} for t > 0 and derives the factor 2 by applying the one-sided inequality to X_i and -X_i."
    },
    {
      "location": "PDF page 6; printed page 17",
      "anchor": "Remark 2.2.4 (Non-asymptotic results)",
      "observation": "The surrounding source explicitly characterizes Hoeffding's inequality as non-asymptotic: it holds for each fixed N rather than only in a limit N -> infinity."
    }
  ],
  "statement": {
    "binders": [
      "N is the finite index count used by X_1, ..., X_N and R^N; the displayed indexing structurally indicates a positive integer N, although the theorem does not separately declare its type. [PDF page 6; printed page 17, Theorem 2.2.5 opening sentence and displayed sum]",
      "X_1, ..., X_N are random variables. [PDF page 6; printed page 17, Theorem 2.2.5 opening sentence]",
      "a = (a_1, ..., a_N) is a deterministic vector in R^N. [PDF page 6; printed page 17, Theorem 2.2.5 opening sentence]",
      "t is a real threshold satisfying t > 0. [PDF page 6; printed page 17, Theorem 2.2.5 phrase `for any t > 0`]"
    ],
    "hypotheses": [
      "The family X_1, ..., X_N is independent. [PDF page 6; printed page 17, Theorem 2.2.5 opening sentence]",
      "Every X_i has the symmetric Bernoulli distribution, hence takes values -1 and 1 with probability 1/2 each. [PDF page 6; printed page 17, Theorem 2.2.5 opening sentence; PDF page 4, printed page 15, Definition 2.2.1]"
    ],
    "conclusions": [
      "P{|sum_{i=1}^N a_i X_i| >= t} <= 2 exp(-t^2/(2 ||a||_2^2)). [PDF page 6; printed page 17, Theorem 2.2.5 displayed inequality]"
    ],
    "definitions_and_conventions": [
      "`Symmetric Bernoulli distribution`, also called `Rademacher distribution`, means support {-1, 1} with P{X = -1} = P{X = 1} = 1/2. [PDF page 4; printed page 15, Definition 2.2.1]",
      "S denotes the weighted sum sum_{i=1}^N a_i X_i in the derivation immediately preceding the theorem. [PDF page 6; printed page 17, paragraph beginning `We can easily derive`]",
      "||a||_2 is the Euclidean 2-norm of the real coefficient vector, so ||a||_2^2 = sum_{i=1}^N a_i^2. [PDF page 5; printed page 16, proof of Theorem 2.2.2 where the normalization ||a||_2 = 1 is used to replace sum a_i^2 by 1; PDF page 6, printed page 17, Theorem 2.2.5 denominator]",
      "The event is a two-sided tail because the absolute value is inside the probability: {|S| >= t}. [PDF page 6; printed page 17, paragraph immediately preceding Theorem 2.2.5 and the theorem's displayed inequality]"
    ],
    "implicit_context": [
      "The random variables are understood on a common probability space so that their independence, weighted sum, and the probability of its tail event are defined; this is inherited standard probability context rather than an explicitly displayed binder. [PDF page 6; printed page 17, Theorem 2.2.5 use of independence, sum, and P]",
      "The notation X_1, ..., X_N, a in R^N, and sum from i = 1 to N implicitly treats N as a finite positive integer; no explicit `N >= 1` clause appears in the theorem. [PDF page 6; printed page 17, Theorem 2.2.5 opening sentence and displayed sum]",
      "The claim is non-asymptotic and applies at each fixed admissible N, not merely as N tends to infinity. [PDF page 6; printed page 17, Remark 2.2.4 immediately preceding the theorem]"
    ],
    "semantic_facets": [
      {
        "topic": "Quantifier scope and object roles",
        "details": [
          "For every finite family of independent symmetric Bernoulli variables and every deterministic real weight vector a, the stated bound holds for every positive real threshold t. [PDF page 6; printed page 17, Theorem 2.2.5]",
          "N controls both the number of random variables and the dimension of a; the same index i pairs a_i with X_i in the weighted sum. [PDF page 6; printed page 17, Theorem 2.2.5 opening sentence and displayed sum]"
        ]
      },
      {
        "topic": "Two-sided tail semantics",
        "details": [
          "The bounded event is the magnitude tail |sum a_i X_i| >= t, simultaneously covering the upper and lower tails. [PDF page 6; printed page 17, theorem title and displayed inequality]",
          "For t > 0, the source decomposes this event as {S >= t} plus {-S >= t} at the probability level and obtains the leading factor 2. [PDF page 6; printed page 17, paragraph immediately preceding Theorem 2.2.5]"
        ]
      },
      {
        "topic": "Scale and constants",
        "details": [
          "The exponential rate is exactly -t^2/(2 ||a||_2^2), and the complete right-hand side has the explicit prefactor 2. [PDF page 6; printed page 17, Theorem 2.2.5 displayed inequality]",
          "The comparison uses >= in the event and <= for the probability bound. [PDF page 6; printed page 17, Theorem 2.2.5 displayed inequality]"
        ]
      },
      {
        "topic": "Distributional assumptions",
        "details": [
          "Independence and the symmetric Bernoulli law are both essential stated hypotheses. [PDF page 6; printed page 17, Theorem 2.2.5 opening sentence]",
          "Symmetric Bernoulli variables are {-1, 1}-valued with equal mass 1/2 at each point. [PDF page 4; printed page 15, Definition 2.2.1]"
        ]
      }
    ]
  },
  "undebatable_constraints": [
    "The probability concerns the absolute value of the weighted sum; omitting the absolute value would change the two-sided theorem into a one-sided statement. [PDF page 6; printed page 17, theorem title, preceding derivation, and displayed inequality]",
    "The X_i must be independent and symmetric Bernoulli, with symmetric Bernoulli fixed by Definition 2.2.1 as equiprobable values -1 and 1. [PDF page 6; printed page 17, Theorem 2.2.5 opening sentence; PDF page 4, printed page 15, Definition 2.2.1]",
    "The coefficients form an arbitrary real vector a in R^N, and the denominator uses ||a||_2^2. [PDF page 6; printed page 17, Theorem 2.2.5 opening sentence and displayed inequality]",
    "The threshold condition is t > 0, not t >= 0. [PDF page 6; printed page 17, Theorem 2.2.5 phrase `for any t > 0`]",
    "The numerical constants are the prefactor 2 and exponent denominator 2 ||a||_2^2. [PDF page 6; printed page 17, Theorem 2.2.5 displayed inequality]",
    "The result is a finite-N, non-asymptotic probability bound. [PDF page 6; printed page 17, Remark 2.2.4 and Theorem 2.2.5]"
  ],
  "ambiguities": [
    {
      "issue": "The theorem quantifies over a in R^N without explicitly excluding a = 0, but its displayed right-hand side contains division by ||a||_2^2.",
      "evidence": "PDF page 6; printed page 17, Theorem 2.2.5 says `a = (a_1, ..., a_N) in R^N` with no nonzero hypothesis, while the displayed exponent is -t^2/(2 ||a||_2^2).",
      "impact": "In ordinary real arithmetic the displayed expression is undefined when a = 0. The source does not state whether that case is excluded, interpreted by a limiting convention with right-hand side 0, or handled separately as the trivial zero-sum event for t > 0."
    },
    {
      "issue": "The domain of N is not separately declared in the theorem statement.",
      "evidence": "PDF page 6; printed page 17, Theorem 2.2.5 uses X_1, ..., X_N, R^N, and a sum indexed from 1 to N, but contains no explicit clause such as `N is a positive integer`.",
      "impact": "The standard structural reading is N >= 1, but an exact formal contract must either encode that inherited convention or state how the empty N = 0 case and its zero norm denominator are treated."
    }
  ],
  "contract_plain_english": "For a finite positive number N of mutually independent Rademacher random variables X_1, ..., X_N, any deterministic real weights a_1, ..., a_N, and any real t > 0, the probability that the magnitude of the weighted sum sum_{i=1}^N a_i X_i is at least t is at most 2 exp(-t^2/(2 ||a||_2^2)). Here each X_i equals -1 or 1 with probability 1/2 each, and ||a||_2 is the Euclidean norm. This is the source's non-asymptotic two-sided Hoeffding bound; the printed formula leaves the all-zero weight vector case formally unspecified because its denominator then vanishes. [PDF page 4, printed page 15, Definition 2.2.1; PDF page 6, printed page 17, Remark 2.2.4, the derivation immediately before Theorem 2.2.5, and Theorem 2.2.5]"
}
