{
  "ambiguities": [
    {
      "evidence": "The exact sentence says the scalar problem 'is hyperbolic provided the scalar A is real'.",
      "impact": "The contract requires the stated real-coefficient implication. A converse involving complex scalar coefficients would go beyond the source's real-valued problem class.",
      "issue": "The word 'provided' states a sufficient condition rather than an explicit biconditional."
    },
    {
      "evidence": "The paragraph classifies the scalar problem from m = 1 and the reality of A without quantifying over solutions or derivatives beyond the displayed PDE notation.",
      "impact": "A formal matrix-level or coefficient-level theorem should not add a solution-existence or differentiability hypothesis unless needed only to encode the surrounding PDE syntax.",
      "issue": "The source does not attach a function-space regularity condition to the scalar classification."
    }
  ],
  "batch_source_contract_sha256": "fe7d116cf60b85222283c704141de3ad0bdb72cda6da84ca010c19fbb4d75440",
  "contract_plain_english": "In the m = 1 constant-coefficient case, any real scalar coefficient A makes q_t + A q_x = 0 hyperbolic; the source imposes no positivity or nonzero condition on A.",
  "role": "source-contract",
  "schema_version": "formalization-faithfulness-1",
  "source_evidence": [
    {
      "anchor": "Equation (1.1) and the paragraph immediately following it",
      "location": "raw PDF page 23; printed Chapter 1 page 1",
      "observation": "The constant-coefficient linear problem is q_t + A q_x = 0 with q taking values in R^m and A a constant real m by m matrix."
    },
    {
      "anchor": "Paragraph beginning 'The simplest case is the constant-coefficient scalar problem'",
      "location": "raw PDF page 23; printed Chapter 1 page 1",
      "observation": "When m = 1, the matrix A reduces to a scalar value, and the source states that this scalar problem is hyperbolic provided the scalar A is real."
    },
    {
      "anchor": "Final sentence of the scalar-specialization paragraph",
      "location": "raw PDF page 23; printed Chapter 1 page 1",
      "observation": "The source notes that this scalar equation can model either advective transport or wave motion depending on context."
    },
    {
      "anchor": "Later matrix hyperbolicity definition",
      "location": "raw PDF page 25; printed Chapter 1 page 3",
      "observation": "The later definition requires real eigenvalues and m linearly independent corresponding eigenvectors; for m = 1, a real scalar coefficient supplies the single real eigenvalue and a one-vector eigenbasis."
    }
  ],
  "source_sha256": "b3adec0d3616dbde57a5522cfce1861890887d7c03a2232d2136cb94c9bac1d5",
  "statement": {
    "binders": [
      "A real scalar-valued unknown q(x,t).",
      "A constant scalar coefficient A."
    ],
    "conclusions": [
      "The scalar constant-coefficient problem q_t + A q_x = 0 is hyperbolic."
    ],
    "definitions_and_conventions": [
      "The scalar problem is the m = 1 specialization of system (1.1).",
      "The coefficient A is the propagation coefficient in the first-order scalar equation.",
      "Hyperbolicity is used in the first-order-system sense later defined through real eigenvalues and a complete eigenvector set."
    ],
    "hypotheses": [
      "The component count is m = 1, so the constant 1 by 1 coefficient matrix is identified with the scalar A.",
      "A is real."
    ],
    "implicit_context": [
      "The coefficient is constant in x and t.",
      "Because the source's ambient matrices are real, the scalar-reality condition is automatic once A is typed as a real number.",
      "No positivity, nonzero, or sign condition on A is imposed."
    ],
    "semantic_facets": [
      {
        "details": [
          "The vector system and matrix coefficient reduce to a single scalar unknown and a single scalar coefficient when m = 1."
        ],
        "topic": "dimension-one specialization"
      },
      {
        "details": [
          "A real scalar is its own real eigenvalue and the one-dimensional space has a one-vector eigenbasis."
        ],
        "topic": "spectral condition"
      },
      {
        "details": [
          "The same hyperbolic scalar equation may represent advection or wave motion depending on the application."
        ],
        "topic": "model interpretation"
      }
    ]
  },
  "task_id": "LEV-CH01-SCALAR-HYPERBOLICITY",
  "undebatable_constraints": [
    "The claim is restricted to the scalar case m = 1.",
    "The coefficient A is constant and real.",
    "The conclusion is that q_t + A q_x = 0 is hyperbolic.",
    "No assumption A > 0, A != 0, or fixed propagation direction appears; zero and negative real coefficients remain within the stated real-scalar condition.",
    "The result is a specialization of the first-order constant-coefficient system, not the second-order PDE classification mentioned later."
  ]
}
