{
  "ambiguities": [
    {
      "evidence": "PDF page 3, printed page 7 presents E 1_{t<X}=P{t<X} only inside integrals whose limits are 0 and \u221e.",
      "impact": "The cited occurrence directly supports the equality for the non-negative integration parameter used there. Extending its standalone statement to every real t is mathematically natural but is broader than the explicit displayed context.",
      "issue": "The source does not state a separate standalone quantifier for t at this equality."
    },
    {
      "evidence": "PDF page 3, printed page 7 begins Lemma 1.2.1 with a non-negative random variable X, and the equality appears later in that lemma's proof.",
      "impact": "A source-faithful extraction must record the inherited assumption; a formulation omitting it may express a valid generalization rather than the exact local context.",
      "issue": "Non-negativity of X is inherited from Lemma 1.2.1 even though the indicator-expectation identity itself does not visibly use it."
    },
    {
      "evidence": "Footnote 4 on PDF page 3 defines 1_E for an arbitrary event E, while the displayed expectation equality on that page is written only for E={t<X}.",
      "impact": "A theorem asserting E[1_E]=P(E) for every event E generalizes the explicit strict-tail instance and should not be mistaken for verbatim source wording.",
      "issue": "The generic all-events identity is suggested but not separately stated at this location."
    }
  ],
  "batch_source_contract_sha256": "f78f795913a1a975aeaa39e69fb325bee52653cb2512d692e64c27a538fa18d9",
  "contract_plain_english": "In the proof for a non-negative random variable X, and for the non-negative integration parameter t, the expected value of the 0\u20131 indicator of the strict event t<X is exactly the probability of that same event.",
  "role": "source-contract",
  "schema_version": "formalization-faithfulness-1",
  "source_evidence": [
    {
      "anchor": "Let X be a non-negative random variable",
      "location": "PDF page 3; printed page 7; statement of Lemma 1.2.1",
      "observation": "The displayed indicator-expectation equality occurs inside a proof whose inherited hypothesis is that X is a non-negative random variable."
    },
    {
      "anchor": "E 1_{t<X} = P{t<X}",
      "location": "PDF page 3; printed page 7; proof of Lemma 1.2.1, final displayed chain of equalities",
      "observation": "The source identifies the expectation of the indicator of the strict event {t<X} with the probability of that same event."
    },
    {
      "anchor": "\u222b_0^\u221e E 1_{t<X} dt = \u222b_0^\u221e P{t<X} dt",
      "location": "PDF page 3; printed page 7; proof of Lemma 1.2.1, final displayed chain of equalities",
      "observation": "The equality is used with t as the variable of integration over the non-negative half-line."
    },
    {
      "anchor": "1_E denotes the indicator of the event E ... takes value 1 if E occurs and 0 otherwise",
      "location": "PDF page 3; printed page 7; footnote 4",
      "observation": "Applied to E={t<X}, the indicator in the displayed equality is 1 exactly when t<X and 0 otherwise."
    },
    {
      "anchor": "the expectation E X of a random variable X on a probability space (\u03a9, \u03a3, P) is ... the Lebesgue integral",
      "location": "PDF page 1; printed page 5; footnote 1",
      "observation": "Expectation and probability in the equality are taken with respect to the same ambient probability space."
    }
  ],
  "source_sha256": "855fdaf6870f664f1e470d47641b6d72758afdb9b87649a6494b027cecc02b17",
  "statement": {
    "binders": [
      "A non-negative real-valued random variable X on the ambient probability space.",
      "A real parameter t, serving in the displayed proof as the integration variable."
    ],
    "conclusions": [
      "E[1_{t<X}] = P{t<X}."
    ],
    "definitions_and_conventions": [
      "The event {t<X} means the strict pointwise event that t<X.",
      "The function 1_{t<X} is 1 on that event and 0 off it.",
      "E denotes expectation and P denotes probability on the ambient probability space."
    ],
    "hypotheses": [
      "X is a non-negative random variable.",
      "In the displayed use, t ranges over [0, \u221e) because it is bound by an integral from 0 to \u221e."
    ],
    "implicit_context": [
      "The equality is a step in the proof of Lemma 1.2.1 rather than a separately numbered result.",
      "The ambient source context is a probability space (\u03a9, \u03a3, P).",
      "The parameter t is the variable in the layer-cake integral over [0, \u221e)."
    ],
    "semantic_facets": [
      {
        "details": [
          "Exactly the same event {t<X} occurs in the indicator and on the probability side.",
          "The comparison is strict; replacing it by t\u2264X or another boundary convention changes the written event."
        ],
        "topic": "Event identity"
      },
      {
        "details": [
          "The expectation of this 0\u20131 indicator equals the probability of its one-valued event."
        ],
        "topic": "Expectation-probability relationship"
      },
      {
        "details": [
          "The proof inherits the lemma's non-negativity assumption on X.",
          "The displayed occurrence binds t over the non-negative half-line."
        ],
        "topic": "Inherited domain"
      }
    ]
  },
  "task_id": "HDP-01-LEM-1.2.1-INDICATOR-EXPECTATION",
  "undebatable_constraints": [
    "The left side is the expectation of an indicator, not the expectation of X itself.",
    "The right side is the probability of the same event used to form the indicator.",
    "The event is written with the strict inequality t<X.",
    "The equality is exact, not an inequality or an almost-everywhere comparison.",
    "At the cited occurrence, X inherits the non-negativity assumption from Lemma 1.2.1.",
    "At the cited occurrence, t is integrated from 0 to \u221e."
  ]
}
